{
  "league": "KBL",
  "season": "2026-27",
  "competition": "regular_season",
  "kbl_season_code": 49,
  "source_id": "kbl-stats-2026-27",
  "retrieved_at": "2026-10-15",
  "players": [
    {
      "kbl_player_id": "290454",
      "name_ko": "정창영",
      "name_en": "JUNG CHANG YOUNG",
      "team_code": "06",
      "height_cm": 193.0,
      "weight_kg": 90.0,
      "gp": 5,
      "mpg": 6.03,
      "ppg": 1.6,
      "rpg": 0.6,
      "orpg": 0.4,
      "drpg": 0.2,
      "apg": 0.0,
      "spg": 0.2,
      "bpg": 0.0,
      "tpg": 0.4,
      "fg_pct": 0.3333,
      "fg3_pct": 0.0,
      "ft_pct": 1.0,
      "fg3a_pg": 0.4,
      "fta_pg": 1.2
    },
    {
      "kbl_player_id": "290583",
      "name_ko": "한희원",
      "name_en": "HAN HEE WON",
      "team_code": "06",
      "height_cm": 195.0,
      "weight_kg": 87.0,
      "gp": 5,
      "mpg": 14.95,
      "ppg": 3.6,
      "rpg": 1.4,
      "orpg": 0.2,
      "drpg": 1.2,
      "apg": 0.6,
      "spg": 0.6,
      "bpg": 0.0,
      "tpg": 0.0,
      "fg_pct": 0.4286,
      "fg3_pct": 0.3333,
      "ft_pct": 0.4444,
      "fg3a_pg": 1.2,
      "fta_pg": 1.8
    },
    {
      "kbl_player_id": "290599",
      "name_ko": "서민수",
      "name_en": "SEO MIN SOO",
      "team_code": "06",
      "height_cm": 196.0,
      "weight_kg": 92.0,
      "gp": 5,
      "mpg": 18.13,
      "ppg": 3.0,
      "rpg": 3.2,
      "orpg": 1.2,
      "drpg": 2.0,
      "apg": 0.8,
      "spg": 0.4,
      "bpg": 0.2,
      "tpg": 0.2,
      "fg_pct": 0.2143,
      "fg3_pct": 0.25,
      "ft_pct": 1.0,
      "fg3a_pg": 2.4,
      "fta_pg": 1.2
    },
    {
      "kbl_player_id": "290763",
      "name_ko": "전성현",
      "name_en": "JEON SEONG HYUN",
      "team_code": "06",
      "height_cm": 189.0,
      "weight_kg": 88.0,
      "gp": 5,
      "mpg": 14.67,
      "ppg": 3.6,
      "rpg": 0.4,
      "orpg": 0.0,
      "drpg": 0.4,
      "apg": 0.8,
      "spg": 0.0,
      "bpg": 0.0,
      "tpg": 0.2,
      "fg_pct": 0.24,
      "fg3_pct": 0.2105,
      "ft_pct": 1.0,
      "fg3a_pg": 3.8,
      "fta_pg": 0.4
    },
    {
      "kbl_player_id": "291352",
      "name_ko": "박지원",
      "name_en": "PARK JI WON",
      "team_code": "06",
      "height_cm": 191.0,
      "weight_kg": 82.0,
      "gp": 4,
      "mpg": 0.99,
      "ppg": 0.5,
      "rpg": 0.0,
      "orpg": 0.0,
      "drpg": 0.0,
      "apg": 0.0,
      "spg": 0.0,
      "bpg": 0.0,
      "tpg": 0.25,
      "fg_pct": 0.5,
      "fg3_pct": null,
      "ft_pct": null,
      "fg3a_pg": 0.0,
      "fta_pg": 0.0
    },
    {
      "kbl_player_id": "291492",
      "name_ko": "하윤기",
      "name_en": "HA YUN GI",
      "team_code": "06",
      "height_cm": 204.0,
      "weight_kg": 100.0,
      "gp": 5,
      "mpg": 13.94,
      "ppg": 4.6,
      "rpg": 3.0,
      "orpg": 1.8,
      "drpg": 1.2,
      "apg": 0.8,
      "spg": 0.2,
      "bpg": 0.0,
      "tpg": 0.4,
      "fg_pct": 0.4762,
      "fg3_pct": null,
      "ft_pct": 0.6,
      "fg3a_pg": 0.0,
      "fta_pg": 1.0
    },
    {
      "kbl_player_id": "291586",
      "name_ko": "이두원",
      "name_en": "LEE DOO WON",
      "team_code": "06",
      "height_cm": 204.0,
      "weight_kg": 103.0,
      "gp": 2,
      "mpg": 6.84,
      "ppg": 1.0,
      "rpg": 1.0,
      "orpg": 0.5,
      "drpg": 0.5,
      "apg": 0.0,
      "spg": 0.5,
      "bpg": 0.0,
      "tpg": 0.0,
      "fg_pct": 0.25,
      "fg3_pct": null,
      "ft_pct": null,
      "fg3a_pg": 0.0,
      "fta_pg": 0.0
    },
    {
      "kbl_player_id": "291667",
      "name_ko": "문정현",
      "name_en": "MOON JEONG HYEON",
      "team_code": "06",
      "height_cm": 194.0,
      "weight_kg": 90.0,
      "gp": 5,
      "mpg": 28.02,
      "ppg": 10.4,
      "rpg": 7.8,
      "orpg": 3.6,
      "drpg": 4.2,
      "apg": 2.2,
      "spg": 1.2,
      "bpg": 0.0,
      "tpg": 1.6,
      "fg_pct": 0.5,
      "fg3_pct": 0.55,
      "ft_pct": 0.375,
      "fg3a_pg": 4.0,
      "fta_pg": 1.6
    },
    {
      "kbl_player_id": "291671",
      "name_ko": "패리스 배스",
      "name_en": "Paris Nickolas Bass",
      "team_code": "06",
      "height_cm": 200.0,
      "weight_kg": 97.0,
      "gp": 5,
      "mpg": 36.71,
      "ppg": 28.2,
      "rpg": 10.8,
      "orpg": 2.2,
      "drpg": 8.6,
      "apg": 4.0,
      "spg": 1.2,
      "bpg": 0.8,
      "tpg": 3.8,
      "fg_pct": 0.4828,
      "fg3_pct": 0.2143,
      "ft_pct": 0.7931,
      "fg3a_pg": 5.6,
      "fta_pg": 5.8
    },
    {
      "kbl_player_id": "291692",
      "name_ko": "미구엘 옥존",
      "name_en": "Miguel Andre Oczon",
      "team_code": "06",
      "height_cm": 180.0,
      "weight_kg": 90.0,
      "gp": 5,
      "mpg": 24.8,
      "ppg": 15.8,
      "rpg": 1.8,
      "orpg": 0.2,
      "drpg": 1.6,
      "apg": 2.2,
      "spg": 0.6,
      "bpg": 0.2,
      "tpg": 1.6,
      "fg_pct": 0.5172,
      "fg3_pct": 0.4,
      "ft_pct": 0.6364,
      "fg3a_pg": 6.0,
      "fta_pg": 2.2
    },
    {
      "kbl_player_id": "291842",
      "name_ko": "강성욱",
      "name_en": "KANG SUNG WOOK",
      "team_code": "06",
      "height_cm": 184.0,
      "weight_kg": 73.0,
      "gp": 5,
      "mpg": 16.48,
      "ppg": 3.0,
      "rpg": 2.0,
      "orpg": 0.4,
      "drpg": 1.6,
      "apg": 1.8,
      "spg": 0.4,
      "bpg": 0.0,
      "tpg": 0.8,
      "fg_pct": 0.1818,
      "fg3_pct": 0.1579,
      "ft_pct": null,
      "fg3a_pg": 3.8,
      "fta_pg": 0.0
    },
    {
      "kbl_player_id": "291885",
      "name_ko": "트레이 포터",
      "name_en": "Trey Samuel Porter",
      "team_code": "06",
      "height_cm": 209.0,
      "weight_kg": 107.0,
      "gp": 5,
      "mpg": 22.72,
      "ppg": 8.8,
      "rpg": 8.4,
      "orpg": 3.0,
      "drpg": 5.4,
      "apg": 0.8,
      "spg": 0.6,
      "bpg": 1.2,
      "tpg": 1.0,
      "fg_pct": 0.5161,
      "fg3_pct": 0.5,
      "ft_pct": 0.7857,
      "fg3a_pg": 0.4,
      "fta_pg": 2.8
    },
    {
      "kbl_player_id": "290489",
      "name_ko": "정준원",
      "name_en": "JUNG JOONWON",
      "team_code": "10",
      "height_cm": 194.0,
      "weight_kg": 84.0,
      "gp": 3,
      "mpg": 2.24,
      "ppg": 2.0,
      "rpg": 0.67,
      "orpg": 0.33,
      "drpg": 0.33,
      "apg": 0.0,
      "spg": 0.0,
      "bpg": 0.0,
      "tpg": 0.0,
      "fg_pct": 0.75,
      "fg3_pct": null,
      "ft_pct": null,
      "fg3a_pg": 0.0,
      "fta_pg": 0.0
    },
    {
      "kbl_player_id": "290787",
      "name_ko": "이승현",
      "name_en": "LEE SEOUNG HYUN",
      "team_code": "10",
      "height_cm": 197.0,
      "weight_kg": 105.0,
      "gp": 4,
      "mpg": 19.56,
      "ppg": 4.25,
      "rpg": 2.75,
      "orpg": 1.25,
      "drpg": 1.5,
      "apg": 1.5,
      "spg": 0.25,
      "bpg": 0.0,
      "tpg": 1.0,
      "fg_pct": 0.4706,
      "fg3_pct": 0.5,
      "ft_pct": null,
      "fg3a_pg": 0.5,
      "fta_pg": 0.0
    },
    {
      "kbl_player_id": "291189",
      "name_ko": "서명진",
      "name_en": "SEO MYEONG JIN",
      "team_code": "10",
      "height_cm": 188.0,
      "weight_kg": 77.0,
      "gp": 4,
      "mpg": 25.68,
      "ppg": 3.5,
      "rpg": 2.75,
      "orpg": 0.0,
      "drpg": 2.75,
      "apg": 2.25,
      "spg": 0.25,
      "bpg": 0.0,
      "tpg": 1.25,
      "fg_pct": 0.2381,
      "fg3_pct": 0.1429,
      "ft_pct": 1.0,
      "fg3a_pg": 3.5,
      "fta_pg": 0.5
    },
    {
      "kbl_player_id": "291208",
      "name_ko": "조한진",
      "name_en": "CHO HAN JIN",
      "team_code": "10",
      "height_cm": 193.0,
      "weight_kg": 90.0,
      "gp": 3,
      "mpg": 13.29,
      "ppg": 3.0,
      "rpg": 0.67,
      "orpg": 0.33,
      "drpg": 0.33,
      "apg": 0.0,
      "spg": 0.33,
      "bpg": 0.33,
      "tpg": 0.33,
      "fg_pct": 0.375,
      "fg3_pct": 0.5,
      "ft_pct": 0.5,
      "fg3a_pg": 1.33,
      "fta_pg": 0.67
    },
    {
      "kbl_player_id": "291275",
      "name_ko": "김경원",
      "name_en": "KIM KYUNG WON",
      "team_code": "10",
      "height_cm": 198.0,
      "weight_kg": 101.0,
      "gp": 3,
      "mpg": 5.68,
      "ppg": 2.0,
      "rpg": 0.67,
      "orpg": 0.0,
      "drpg": 0.67,
      "apg": 0.33,
      "spg": 0.0,
      "bpg": 0.0,
      "tpg": 0.33,
      "fg_pct": 1.0,
      "fg3_pct": null,
      "ft_pct": null,
      "fg3a_pg": 0.0,
      "fta_pg": 0.0
    },
    {
      "kbl_player_id": "291375",
      "name_ko": "이우석",
      "name_en": "LEE WOO SUK",
      "team_code": "10",
      "height_cm": 196.0,
      "weight_kg": 83.0,
      "gp": 4,
      "mpg": 35.43,
      "ppg": 15.25,
      "rpg": 6.25,
      "orpg": 1.75,
      "drpg": 4.5,
      "apg": 4.25,
      "spg": 0.75,
      "bpg": 0.25,
      "tpg": 1.5,
      "fg_pct": 0.4314,
      "fg3_pct": 0.2333,
      "ft_pct": 0.6667,
      "fg3a_pg": 7.5,
      "fta_pg": 3.75
    },
    {
      "kbl_player_id": "291579",
      "name_ko": "게이지 프림",
      "name_en": "Gaige Colburn Prim",
      "team_code": "10",
      "height_cm": 206.0,
      "weight_kg": 117.0,
      "gp": 4,
      "mpg": 32.87,
      "ppg": 29.5,
      "rpg": 9.75,
      "orpg": 4.5,
      "drpg": 5.25,
      "apg": 3.25,
      "spg": 0.5,
      "bpg": 0.75,
      "tpg": 3.0,
      "fg_pct": 0.5526,
      "fg3_pct": 1.0,
      "ft_pct": 0.8611,
      "fg3a_pg": 0.75,
      "fta_pg": 9.0
    },
    {
      "kbl_player_id": "291594",
      "name_ko": "김태완",
      "name_en": "KIM TAE WAN",
      "team_code": "10",
      "height_cm": 181.0,
      "weight_kg": 73.0,
      "gp": 3,
      "mpg": 6.13,
      "ppg": 2.0,
      "rpg": 0.0,
      "orpg": 0.0,
      "drpg": 0.0,
      "apg": 0.33,
      "spg": 0.33,
      "bpg": 0.0,
      "tpg": 0.33,
      "fg_pct": 0.6667,
      "fg3_pct": 0.6667,
      "ft_pct": null,
      "fg3a_pg": 1.0,
      "fta_pg": 0.0
    },
    {
      "kbl_player_id": "291649",
      "name_ko": "박무빈",
      "name_en": "PARK MU BIN",
      "team_code": "10",
      "height_cm": 184.0,
      "weight_kg": 77.0,
      "gp": 4,
      "mpg": 27.8,
      "ppg": 7.75,
      "rpg": 4.5,
      "orpg": 0.75,
      "drpg": 3.75,
      "apg": 5.0,